{
  "source_id": "MKD-EU-2025-008",
  "extraction": {
    "run_id": "RUN-2026-01",
    "rules_version": "0.4",
    "extracted_at": "2026-10-29",
    "status": "complete",
    "pages_processed": "1-5",
    "codebook_version": "1.2",
    "themes_version": "1.3",
    "notes": "Whole decision read (pages 1-5). No items extracted: the decision approves the first release of funds and states that North Macedonia satisfactorily fulfilled 2 out of 5 payment conditions (recital 8), but none of the steps assessed concerns Chapter 2 or a technology or digital matter (the step-by-step assessment is in the annex, MKD-EU-2025-009, which covers December 2024 steps on internal financial control, the Organic Budget Law, the Just Transition Roadmap, State-Owned Companies and judicial vacancies). The remaining text is procedural and financial (facility and loan agreements, amounts, pre-financing clearance). Second-pass check done (G3 condition 2), see review/RUN-2026-01/second_pass/."
  },
  "classification": {
    "status": "complete",
    "run_id": "RUN-2026-01",
    "rules_version": "0.2",
    "taxonomy_version": "1.0",
    "classified_at": "2026-10-30",
    "mechanisms_version": "1.0"
  },
  "items": []
}