{
  "source_id": "MKD-EU-2021-003",
  "extraction": {
    "run_id": "RUN-2026-01",
    "rules_version": "0.4",
    "extracted_at": "2026-10-29",
    "status": "complete",
    "pages_processed": "1-29",
    "codebook_version": "1.2",
    "themes_version": "1.3",
    "notes": "Whole document read. The North Macedonia paragraphs (40 to 50, pages 18-21) contain no Chapter 2 or technology content (elections, rule of law, judiciary, public administration, intelligence services, migration, economic reforms, census, bilateral relations, CFSP). Horizontal passages addressed to all partners were checked; one passage naming cyber-resilience is extracted with theme_doubtful. Not extracted: 'Green Agenda and sustainable connectivity' (no digital content stated), and passages on other countries (for example online harassment in Montenegro). Speaker recorded as 'Council' as printed. Second-pass check done (G3 condition 2), see review/RUN-2026-01/second_pass/."
  },
  "classification": {
    "status": "complete",
    "run_id": "RUN-2026-01",
    "rules_version": "0.2",
    "taxonomy_version": "1.0",
    "classified_at": "2026-10-30",
    "mechanisms_version": "1.0"
  },
  "items": [
    {
      "item_id": "MKD-EU-2021-003-0001",
      "information_type": "recommendation",
      "stated_text": "The hybrid threats call for reinforced cooperation and closer collaboration, including on cyber-resilience, the protection of critical infrastructures, strategic communication and addressing disinformation.",
      "quote_language": "en",
      "translation_en": null,
      "machine_translated": false,
      "summary": "The Council says hybrid threats call for closer cooperation, including on cyber-resilience, protection of critical infrastructure, strategic communication and countering disinformation.",
      "location": {
        "page": 8,
        "page_end": null,
        "section": "ANNEX > GENERAL AFFAIRS COUNCIL CONCLUSIONS ON ENLARGEMENT AND STABILISATION AND ASSOCIATION PROCESS",
        "paragraph": "12",
        "snapshot_file": null
      },
      "quote_verified": true,
      "country": "MKD",
      "role": "target",
      "cluster": null,
      "chapter": null,
      "scope_basis": [
        "theme"
      ],
      "themes": [
        "TECH-CYBER"
      ],
      "dates": {
        "publication_date": "2021-12-14",
        "period_covered": null,
        "event_date": null,
        "event_date_precision": null
      },
      "speaker": {
        "name_as_stated": "Council",
        "actor_id": "ACT-EU-0003"
      },
      "subjects": [
        {
          "name_as_stated": "partners",
          "actor_id": null
        }
      ],
      "intervention_as_stated": null,
      "stated_status": null,
      "eu_scale": {
        "preparation_level": null,
        "progress_level": null,
        "applies_to": null
      },
      "metric": {
        "indicator": null,
        "value": null,
        "unit": null,
        "reference_period": null
      },
      "flags": [
        "theme_doubtful"
      ],
      "extraction_note": "Horizontal passage addressed to all partners (the paragraph speaks of 'partners'). Doubtful: cyber-resilience is one of four strands of cooperation against hybrid threats, in a foreign and security policy context.",
      "pass2": {
        "chain_link": "eu_requirement",
        "reform_issue_ids": [],
        "mechanism_ids": [],
        "intervention_ids": [],
        "classification_status": "out_of_scope",
        "classification_note": "Hybrid threats passage; cyber is one strand in a list and no gap fits RI-TEC-023 or RI-TEC-022, so the materiality test is not met."
      }
    }
  ]
}