{
  "source_id": "MKD-IO-2021-001",
  "extraction": {
    "run_id": "RUN-2026-01",
    "rules_version": "0.3",
    "extracted_at": "2026-10-29",
    "status": "sample",
    "pages_processed": "3-8, 36-39",
    "codebook_version": "1.2",
    "themes_version": "1.2",
    "notes": "Read the preface, contents, key messages and introduction (pages 3-9, page 9 in part) and the conclusions and policy implications (pages 36-39); body chapters 2 to 5 (pages 11-35) were not extracted in this sample. Under the Chapter 2 boundary in the run record (R8, R13) no passage read qualifies: the report concerns emigration, diaspora, return, skills and North Macedonian nationals' access to EU labour markets (Bulgarian passports, Germany's Skilled Labour Immigration Act, EU Talent Partnerships), and does not address the rights of EU or foreign workers in North Macedonia, EURES, the European Labour Authority, social security coordination or the European Health Insurance Card. No passage meets the technology theme materiality test. Pages 46-47 (text recognition) are blank. Revised on 29 October 2026 under extraction rules 0.3 (R12 to R20). Items 0005, 0011, 0026, 0028, 0040, 0047 and 0048 removed under R13; the file has no items."
  },
  "classification": {
    "status": "not_started"
  },
  "items": []
}
