{
  "source_id": "MKD-EU-2022-003",
  "extraction": {
    "run_id": "RUN-2026-01",
    "rules_version": "0.4",
    "extracted_at": "2026-10-29",
    "status": "complete",
    "pages_processed": "1-3",
    "codebook_version": "1.2",
    "themes_version": "1.3",
    "notes": "Whole document read. Nothing in scope: the North Macedonia paragraphs (1 to 7) concern bilateral relations with Bulgaria, constitutional changes, the negotiating framework, the intergovernmental conference and screening; there is no Chapter 2 or technology content and no horizontal passage. Items list left empty. Second-pass check done (G3 condition 2), see review/RUN-2026-01/second_pass/."
  },
  "classification": {
    "status": "not_started"
  },
  "items": []
}
