{
  "source_id": "MKD-EU-2025-013",
  "extraction": {
    "run_id": "RUN-2026-01",
    "rules_version": "0.4",
    "extracted_at": "2026-10-29",
    "status": "complete",
    "pages_processed": "1-35 (North Macedonia section pages 23-26 read in full; other pages scanned for North Macedonia passages)",
    "codebook_version": "1.2",
    "themes_version": "1.3",
    "notes": "Pass 1 full extraction under rules 0.4 and themes 1.3. Multi-country joint conclusions: per analyst guidance only the North Macedonia section (pages 23-26) is extracted. No Chapter 2 content. One item: the low degree of digitalisation of the economy and public administration services. Not extracted: the integrated financial management information system in policy guidance 2 (back-office public finance system) and the accession to the Single Euro Payments Area (payments system, out under rules 0.4). Period covered not given; left empty. Second-pass check done (G3 condition 2), see review/RUN-2026-01/second_pass/."
  },
  "classification": {
    "status": "not_started"
  },
  "items": [
    {
      "item_id": "MKD-EU-2025-013-0001",
      "information_type": "finding",
      "stated_text": "Key structural challenges arise from the large size of the informal economy, the skills mismatch in the labour market and low labour market participation rates, as well as muted innovation activity and the low degree of digitalisation of the economy and public administration services.",
      "quote_language": "en",
      "translation_en": null,
      "machine_translated": false,
      "summary": "Key structural challenges include the low degree of digitalisation of the economy and of public administration services, among other factors.",
      "location": {
        "page": 25,
        "page_end": null,
        "section": "North Macedonia",
        "paragraph": null,
        "snapshot_file": null
      },
      "quote_verified": true,
      "country": "MKD",
      "role": "target",
      "cluster": null,
      "chapter": null,
      "scope_basis": [
        "theme"
      ],
      "themes": [
        "TECH-DIGI",
        "TECH-DGOV"
      ],
      "dates": {
        "publication_date": "2025-05-13",
        "period_covered": null,
        "event_date": null,
        "event_date_precision": null
      },
      "speaker": {
        "name_as_stated": "Participants of the Economic and Financial Dialogue",
        "actor_id": null
      },
      "subjects": [
        {
          "name_as_stated": "North Macedonia",
          "actor_id": null
        }
      ],
      "intervention_as_stated": null,
      "stated_status": null,
      "eu_scale": {
        "preparation_level": null,
        "progress_level": null,
        "applies_to": null
      },
      "metric": {
        "indicator": null,
        "value": null,
        "unit": null,
        "reference_period": null
      },
      "flags": [],
      "extraction_note": "Only the digitalisation element meets the materiality test.",
      "pass2": {
        "chain_link": null,
        "reform_issue_ids": [],
        "mechanism_ids": [],
        "intervention_ids": [],
        "classification_status": "not_classified",
        "classification_note": null
      }
    }
  ]
}
