{
  "source_id": "MKD-EU-2025-010",
  "extraction": {
    "run_id": "RUN-2026-01",
    "rules_version": "0.4",
    "extracted_at": "2026-10-29",
    "status": "complete",
    "pages_processed": "1-8",
    "codebook_version": "1.2",
    "themes_version": "1.3",
    "notes": "Whole decision read (pages 1-8). No items extracted: the decision approves the second release of funds to Albania, Montenegro and North Macedonia and states that North Macedonia satisfactorily fulfilled 4 out of 16 payment conditions (recital 10), without naming the steps; the step-level assessment, including the cybersecurity, electronic communications, electronic identification and electronic archiving steps, is in Annex III (MKD-EU-2025-011) and is extracted there. The rest of the text concerns Albania, Montenegro or financial and procedural matters. Second-pass check done (G3 condition 2), see review/RUN-2026-01/second_pass/."
  },
  "classification": {
    "status": "complete",
    "run_id": "RUN-2026-01",
    "rules_version": "0.2",
    "taxonomy_version": "1.0",
    "classified_at": "2026-10-30",
    "mechanisms_version": "1.0"
  },
  "items": []
}