{
  "source_id": "MKD-GOV-2024-004",
  "extraction": {
    "run_id": "RUN-2026-01",
    "rules_version": "0.4",
    "extracted_at": "2026-10-30",
    "status": "complete",
    "pages_processed": "none",
    "codebook_version": "1.2",
    "themes_version": "1.3",
    "notes": "Not extracted, and the full text was not read. This is the Macedonian version of the Reform Agenda of North Macedonia 2024-2027; the English text is registered as MKD-GOV-2024-001 and has been extracted. The run uses Macedonian or Albanian only for core relevant sources with no suitable English version, and a suitable English version exists here. Status complete with an empty items list."
  },
  "classification": {
    "status": "complete",
    "run_id": "RUN-2026-01",
    "rules_version": "0.3",
    "taxonomy_version": "1.1",
    "classified_at": "2026-10-30",
    "mechanisms_version": "1.0"
  },
  "items": []
}