{
  "source_id": "MKD-RES-2026-001",
  "extraction": {
    "run_id": "RUN-2026-01",
    "rules_version": "0.4",
    "extracted_at": "2026-10-30",
    "status": "complete",
    "pages_processed": "1-2",
    "codebook_version": "1.2",
    "themes_version": "1.3",
    "notes": "Whole two-page highlights read. Only one item: a doubtful reference to digital education. All other claims concern education, vocational training, activation, general employment outcomes, social dialogue, social services and Roma inclusion, which are general labour-market or social policy and outside the Chapter 2 boundary in the run record (rules 0.4, section 4). The source has no content on foreign or EU workers, EURES, the European Labour Authority, social security coordination or EHIC. Speaker is recorded as the EU Delegation to North Macedonia, the institution in the source register; the printed text does not name the evaluator. Second-pass check done (G3 condition 2)."
  },
  "classification": {
    "status": "complete",
    "run_id": "RUN-2026-01",
    "rules_version": "0.2",
    "taxonomy_version": "1.0",
    "classified_at": "2026-10-30",
    "mechanisms_version": "1.0"
  },
  "items": [
    {
      "item_id": "MKD-RES-2026-001-0001",
      "information_type": "recommendation",
      "stated_text": "Support continuous professional development for teachers, build on progress in digital education through a national framework, and ensure sustainable funding through state budgets and performance-based support.",
      "quote_language": "en",
      "translation_en": null,
      "machine_translated": false,
      "summary": "The evaluation recommends building on progress in digital education through a national framework, alongside teacher development and sustainable funding.",
      "location": {
        "page": 2,
        "page_end": null,
        "section": "Recommendations",
        "paragraph": null,
        "snapshot_file": null
      },
      "quote_verified": true,
      "country": "MKD",
      "role": "target",
      "cluster": null,
      "chapter": null,
      "scope_basis": [
        "theme"
      ],
      "themes": [
        "TECH-DIGI"
      ],
      "dates": {
        "publication_date": "2026-05",
        "period_covered": "2025-02/2025-11",
        "event_date": null,
        "event_date_precision": null
      },
      "speaker": {
        "name_as_stated": "EU Delegation to North Macedonia",
        "actor_id": "ACT-EU-0005"
      },
      "subjects": [
        {
          "name_as_stated": "North Macedonia",
          "actor_id": "ACT-MKD-0001"
        }
      ],
      "intervention_as_stated": null,
      "stated_status": null,
      "eu_scale": {
        "preparation_level": null,
        "progress_level": null,
        "applies_to": null
      },
      "metric": {
        "indicator": null,
        "value": null,
        "unit": null,
        "reference_period": null
      },
      "flags": [
        "theme_doubtful"
      ],
      "extraction_note": "Doubtful: digital education appears inside a vocational education recommendation; no in-scope technology recommendation is linked (R2). Tagged for the analyst.",
      "pass2": {
        "chain_link": "unresolved_gap",
        "reform_issue_ids": [],
        "mechanism_ids": [],
        "intervention_ids": [],
        "classification_status": "out_of_scope",
        "classification_note": "Digital education inside a vocational education recommendation; not linked to an in-scope technology recommendation (R2)."
      }
    }
  ]
}