{
  "source_id": "MKD-EU-2022-004",
  "extraction": {
    "run_id": "RUN-2026-01",
    "rules_version": "0.4",
    "extracted_at": "2026-10-29",
    "status": "complete",
    "pages_processed": "1-35",
    "codebook_version": "1.2",
    "themes_version": "1.3",
    "notes": "Whole document read. The North Macedonia paragraphs (55 to 66, pages 23-25) contain no Chapter 2 or technology content. Three horizontal passages addressed to the Western Balkans or all partners are extracted (Digital Agenda, digital service delivery, cyber cooperation). Not extracted: 'digital policy' in a list of areas of EU engagement (paragraph 3, no claim about partners), the EU commitment to support partners' resilience in areas 'such as food and energy security and cyber threats' (paragraph 17: the EU's own assistance commitment with cyber threats as one example), 'promoting the crucial green and digital transitions' in budget policy (paragraph 18, incidental), the sentence 'The EU will continue deepen this cooperation and its support to partners' after item -0003 (EU commitment), and passages about other countries. Speaker recorded as 'Council' as printed. Second-pass check done (G3 condition 2), see review/RUN-2026-01/second_pass/."
  },
  "classification": {
    "status": "complete",
    "run_id": "RUN-2026-01",
    "rules_version": "0.3",
    "taxonomy_version": "1.1",
    "classified_at": "2026-10-30",
    "mechanisms_version": "1.0"
  },
  "items": [
    {
      "item_id": "MKD-EU-2022-004-0001",
      "information_type": "intervention",
      "stated_text": "In this context, the Council is looking forward to the full implementation of the Economic and Investment Plan and the Green and Digital Agendas for the Western Balkans, both important tools for bridging the socio-economic gap, improving infrastructure and connectivity, and supporting the region’s green and digital transition while building resilience and energy independence.",
      "quote_language": "en",
      "translation_en": null,
      "machine_translated": false,
      "summary": "The Council looks forward to full implementation of the Economic and Investment Plan and the Green and Digital Agendas for the Western Balkans, supporting the digital transition.",
      "location": {
        "page": 3,
        "page_end": null,
        "section": "ANNEX > COUNCIL CONCLUSIONS ON ENLARGEMENT AND STABILISATION AND ASSOCIATION PROCESS",
        "paragraph": "3",
        "snapshot_file": null
      },
      "quote_verified": true,
      "country": "MKD",
      "role": "target",
      "cluster": null,
      "chapter": null,
      "scope_basis": [
        "theme"
      ],
      "themes": [
        "TECH-DIGI"
      ],
      "dates": {
        "publication_date": "2022-12-13",
        "period_covered": null,
        "event_date": null,
        "event_date_precision": null
      },
      "speaker": {
        "name_as_stated": "Council",
        "actor_id": "ACT-EU-0003"
      },
      "subjects": [
        {
          "name_as_stated": "Western Balkans",
          "actor_id": null
        }
      ],
      "intervention_as_stated": "Digital Agenda for the Western Balkans",
      "stated_status": "in_progress",
      "eu_scale": {
        "preparation_level": null,
        "progress_level": null,
        "applies_to": null
      },
      "metric": {
        "indicator": null,
        "value": null,
        "unit": null,
        "reference_period": null
      },
      "flags": [
        "ambiguous_type",
        "theme_doubtful"
      ],
      "extraction_note": "Horizontal passage on the Western Balkans. Typed intervention (named programme) with status in_progress, since full implementation is awaited; it could also be read as an EU expectation (recommendation). Doubtful: the Digital Agenda is named together with the Economic and Investment Plan and the Green Agenda, and no digital measure is described.",
      "pass2": {
        "chain_link": "country_response",
        "reform_issue_ids": [],
        "mechanism_ids": [],
        "intervention_ids": [
          "INT-EU-0001",
          "INT-EU-0002"
        ],
        "classification_status": "out_of_scope",
        "classification_note": "General Council statement on implementing the Digital Agenda and the investment plan; no gap fits an approved issue."
      }
    },
    {
      "item_id": "MKD-EU-2022-004-0002",
      "information_type": "finding",
      "stated_text": "While welcoming examples of positive reforms, for example in digital service delivery, the Council notes the need for depoliticisation and increasing accountability and professionalism at all levels: essential features of responsive, effective and accountable governance.",
      "quote_language": "en",
      "translation_en": null,
      "machine_translated": false,
      "summary": "The Council welcomes examples of positive public administration reforms among partners, for example in digital service delivery.",
      "location": {
        "page": 7,
        "page_end": null,
        "section": "ANNEX > COUNCIL CONCLUSIONS ON ENLARGEMENT AND STABILISATION AND ASSOCIATION PROCESS",
        "paragraph": "15",
        "snapshot_file": null
      },
      "quote_verified": true,
      "country": "MKD",
      "role": "target",
      "cluster": null,
      "chapter": null,
      "scope_basis": [
        "theme"
      ],
      "themes": [
        "TECH-DGOV"
      ],
      "dates": {
        "publication_date": "2022-12-13",
        "period_covered": null,
        "event_date": null,
        "event_date_precision": null
      },
      "speaker": {
        "name_as_stated": "Council",
        "actor_id": "ACT-EU-0003"
      },
      "subjects": [
        {
          "name_as_stated": "enlargement partners",
          "actor_id": null
        }
      ],
      "intervention_as_stated": null,
      "stated_status": null,
      "eu_scale": {
        "preparation_level": null,
        "progress_level": null,
        "applies_to": null
      },
      "metric": {
        "indicator": null,
        "value": null,
        "unit": null,
        "reference_period": null
      },
      "flags": [],
      "extraction_note": "Horizontal passage on public administration reform across partners; no partner is named. Only the welcome of digital service delivery is in scope; the rest of the sentence (depoliticisation, accountability) is not technology content and is not extracted as a separate item.",
      "pass2": {
        "chain_link": "eu_requirement",
        "reform_issue_ids": [
          "RI-TEC-003"
        ],
        "mechanism_ids": [],
        "intervention_ids": [],
        "classification_status": "auto",
        "classification_note": "Assigned on the digital service delivery element only."
      }
    },
    {
      "item_id": "MKD-EU-2022-004-0003",
      "information_type": "finding",
      "stated_text": "The Council recalls its increasing cooperation with partners to counter hybrid threats, in particular on cyber resilience and cyber security, including protecting critical infrastructure and food and energy security.",
      "quote_language": "en",
      "translation_en": null,
      "machine_translated": false,
      "summary": "The Council recalls its growing cooperation with partners against hybrid threats, in particular on cyber resilience and cyber security.",
      "location": {
        "page": 11,
        "page_end": null,
        "section": "ANNEX > COUNCIL CONCLUSIONS ON ENLARGEMENT AND STABILISATION AND ASSOCIATION PROCESS",
        "paragraph": "23",
        "snapshot_file": null
      },
      "quote_verified": true,
      "country": "MKD",
      "role": "target",
      "cluster": null,
      "chapter": null,
      "scope_basis": [
        "theme"
      ],
      "themes": [
        "TECH-CYBER"
      ],
      "dates": {
        "publication_date": "2022-12-13",
        "period_covered": null,
        "event_date": null,
        "event_date_precision": null
      },
      "speaker": {
        "name_as_stated": "Council",
        "actor_id": "ACT-EU-0003"
      },
      "subjects": [
        {
          "name_as_stated": "partners",
          "actor_id": null
        }
      ],
      "intervention_as_stated": null,
      "stated_status": null,
      "eu_scale": {
        "preparation_level": null,
        "progress_level": null,
        "applies_to": null
      },
      "metric": {
        "indicator": null,
        "value": null,
        "unit": null,
        "reference_period": null
      },
      "flags": [
        "theme_doubtful"
      ],
      "extraction_note": "Horizontal passage addressed to all partners. Typed finding: cooperation described without a named measure. Doubtful: cyber security is the main named strand, but the context is foreign and security policy cooperation against hybrid threats. Compare MKD-EU-2021-003-0001.",
      "pass2": {
        "chain_link": "eu_requirement",
        "reform_issue_ids": [
          "RI-TEC-023"
        ],
        "mechanism_ids": [],
        "intervention_ids": [],
        "classification_status": "auto",
        "classification_note": "Materiality met on cyber resilience and cyber security."
      }
    }
  ]
}