{
  "source_id": "MKD-EU-2024-003",
  "extraction": {
    "run_id": "RUN-2026-01",
    "rules_version": "0.4",
    "extracted_at": "2026-10-29",
    "status": "complete",
    "pages_processed": "1-20",
    "codebook_version": "1.2",
    "themes_version": "1.3",
    "notes": "Pass 1 full extraction from the converted text file under extraction rules 0.4. All 20 pages read. Annex I (pages 2-4) is a table of third-party indices on democracy, governance and the rule of law (Freedom House Nations in Transit, EIU Democracy Index, RSF World Press Freedom Index, WJP Rule of Law Index, World Bank governance indicators, Transparency International Corruption Perceptions Index); Annex II (pages 5-20) is statistical tables on demography, labour market, education, national accounts, trade, finance and business. No row concerns Chapter 2 (as bounded in the run record) or the technology and AI theme: there are no indicators on digital services, connectivity, cybersecurity, data protection or worker mobility. No items extracted; the file is written with an empty items list. Second-pass check done (G3 condition 2), see review/RUN-2026-01/second_pass/."
  },
  "classification": {
    "status": "complete",
    "run_id": "RUN-2026-01",
    "rules_version": "0.2",
    "taxonomy_version": "1.0",
    "classified_at": "2026-10-30",
    "mechanisms_version": "1.0"
  },
  "items": []
}