{
  "source_id": "SRB-GOV-2026-001",
  "extraction": {
    "run_id": "RUN-2026-01",
    "rules_version": "0.4",
    "extracted_at": "2026-10-30",
    "status": "complete",
    "pages_processed": "whole page",
    "codebook_version": "1.2",
    "themes_version": "1.3",
    "notes": "Undated ministry page, retrieved 2026-10-30; the year in the source ID is the retrieval year, not a publication year. It describes the mechanism and gives no evidence on results."
  },
  "classification": {
    "status": "complete",
    "run_id": "RUN-2026-01",
    "rules_version": "0.3",
    "taxonomy_version": "1.1",
    "classified_at": "2026-10-30",
    "mechanisms_version": "1.0"
  },
  "items": [
    {
      "item_id": "SRB-GOV-2026-001-0001",
      "information_type": "intervention",
      "stated_text": "Essentially, the Act brought a crucial change that relates to the obligation of administration to exchange data and documents from official records among themselves in any possible way.",
      "quote_language": "en",
      "translation_en": null,
      "machine_translated": false,
      "summary": "The ministry says the 2016 procedure law obliges the administration to exchange official-record data and documents among themselves.",
      "location": {
        "page": null,
        "page_end": null,
        "section": "Administrative procedure reform",
        "paragraph": null,
        "snapshot_file": "sources/SRB/GOV/originals/SRB-GOV-2026-001_MDULS_Administrative-Procedure-Reform.html"
      },
      "quote_verified": true,
      "country": "SRB",
      "role": "comparator",
      "cluster": null,
      "chapter": null,
      "scope_basis": [
        "theme"
      ],
      "themes": [
        "TECH-INTEROP",
        "TECH-DATA"
      ],
      "dates": {
        "publication_date": "undated",
        "period_covered": "",
        "event_date": null,
        "event_date_precision": null
      },
      "speaker": {
        "name_as_stated": "Ministry of Public Administration and Local Self-Government",
        "actor_id": "ACT-SRB-0001"
      },
      "subjects": [
        {
          "name_as_stated": "administration",
          "actor_id": null
        }
      ],
      "intervention_as_stated": "Law on General Administrative Procedure (2016)",
      "stated_status": "adopted",
      "eu_scale": {
        "preparation_level": null,
        "progress_level": null,
        "applies_to": null
      },
      "metric": {
        "indicator": null,
        "value": null,
        "unit": null,
        "reference_period": null
      },
      "flags": [
        "out_of_window"
      ],
      "extraction_note": "Law adopted before the window (stated on the page as February 29, 2016); kept because the duty explains the mechanism and REQ-070 was approved for it.",
      "pass2": {
        "chain_link": "comparator_evidence",
        "reform_issue_ids": [
          "RI-TEC-028"
        ],
        "mechanism_ids": [],
        "intervention_ids": [
          "INT-SRB-0008"
        ],
        "classification_status": "auto",
        "classification_note": "country_response: The duty on bodies to exchange data from official records. Undated page."
      }
    },
    {
      "item_id": "SRB-GOV-2026-001-0002",
      "information_type": "intervention",
      "stated_text": "Given that digitization is an important segment of the reform, the Government of the Republic of Serbia has also provided a mechanism for electronic data exchange – the eZUP platform.",
      "quote_language": "en",
      "translation_en": null,
      "machine_translated": false,
      "summary": "The Government provided the eZUP platform as the mechanism for electronic data exchange.",
      "location": {
        "page": null,
        "page_end": null,
        "section": "Administrative procedure reform",
        "paragraph": null,
        "snapshot_file": "sources/SRB/GOV/originals/SRB-GOV-2026-001_MDULS_Administrative-Procedure-Reform.html"
      },
      "quote_verified": true,
      "country": "SRB",
      "role": "comparator",
      "cluster": null,
      "chapter": null,
      "scope_basis": [
        "theme"
      ],
      "themes": [
        "TECH-INTEROP",
        "TECH-DATA"
      ],
      "dates": {
        "publication_date": "undated",
        "period_covered": "",
        "event_date": null,
        "event_date_precision": null
      },
      "speaker": {
        "name_as_stated": "Ministry of Public Administration and Local Self-Government",
        "actor_id": "ACT-SRB-0001"
      },
      "subjects": [
        {
          "name_as_stated": "administration",
          "actor_id": null
        }
      ],
      "intervention_as_stated": "eZUP platform",
      "stated_status": "implemented",
      "eu_scale": {
        "preparation_level": null,
        "progress_level": null,
        "applies_to": null
      },
      "metric": {
        "indicator": null,
        "value": null,
        "unit": null,
        "reference_period": null
      },
      "flags": [],
      "extraction_note": null,
      "pass2": {
        "chain_link": "comparator_evidence",
        "reform_issue_ids": [
          "RI-TEC-028"
        ],
        "mechanism_ids": [],
        "intervention_ids": [
          "INT-SRB-0003"
        ],
        "classification_status": "auto",
        "classification_note": "country_response: Undated page."
      }
    },
    {
      "item_id": "SRB-GOV-2026-001-0003",
      "information_type": "metric",
      "stated_text": "Today eZUP connects 18 databases of eight major institutions in Serbia: Vital records based in our Ministry, Ministry of Interior database, Tax Administration, Pension Fund, National Employment Service, Central Registry of Compulsory Social Security, Republic Geodetic Authority and Ministry of Justice.",
      "quote_language": "en",
      "translation_en": null,
      "machine_translated": false,
      "summary": "The ministry says eZUP connects 18 databases of eight major institutions.",
      "location": {
        "page": null,
        "page_end": null,
        "section": "Administrative procedure reform",
        "paragraph": null,
        "snapshot_file": "sources/SRB/GOV/originals/SRB-GOV-2026-001_MDULS_Administrative-Procedure-Reform.html"
      },
      "quote_verified": true,
      "country": "SRB",
      "role": "comparator",
      "cluster": null,
      "chapter": null,
      "scope_basis": [
        "theme"
      ],
      "themes": [
        "TECH-INTEROP",
        "TECH-DATA"
      ],
      "dates": {
        "publication_date": "undated",
        "period_covered": "",
        "event_date": null,
        "event_date_precision": null
      },
      "speaker": {
        "name_as_stated": "Ministry of Public Administration and Local Self-Government",
        "actor_id": "ACT-SRB-0001"
      },
      "subjects": [
        {
          "name_as_stated": "administration",
          "actor_id": null
        }
      ],
      "intervention_as_stated": null,
      "stated_status": null,
      "eu_scale": {
        "preparation_level": null,
        "progress_level": null,
        "applies_to": null
      },
      "metric": {
        "indicator": "Databases and institutions connected to eZUP",
        "value": "18 databases; 8 institutions",
        "unit": "count",
        "reference_period": "undated"
      },
      "flags": [],
      "extraction_note": "\"Today\" is undated, so this cannot be placed against the Commission's \"more databases\" or used as a time series.",
      "pass2": {
        "chain_link": "comparator_evidence",
        "reform_issue_ids": [
          "RI-TEC-028"
        ],
        "mechanism_ids": [],
        "intervention_ids": [
          "INT-SRB-0003"
        ],
        "classification_status": "auto",
        "classification_note": "implementation: Undated \"today\", so not a time series; no volume of use."
      }
    }
  ]
}