{
  "source_id": "MNE-RES-2026-001",
  "extraction": {
    "run_id": "RUN-2026-01",
    "rules_version": "0.4",
    "extracted_at": "2026-10-30",
    "status": "complete",
    "pages_processed": "1 (webpage)",
    "codebook_version": "1.2",
    "themes_version": "1.3",
    "notes": "Law firm note, secondary. Most of the note concerns third-country nationals and is left out. It does not mention the accession clause in the law."
  },
  "classification": {
    "status": "complete",
    "run_id": "RUN-2026-01",
    "rules_version": "0.3",
    "taxonomy_version": "1.1",
    "classified_at": "2026-10-30",
    "mechanisms_version": "1.0"
  },
  "items": [
    {
      "item_id": "MNE-RES-2026-001-0001",
      "information_type": "intervention",
      "stated_text": "On the last day of 2025, the Parliament of Montenegro voted for the amendments to the Foreigners Act which entered into force on 17 January 2026.",
      "quote_language": "en",
      "translation_en": null,
      "machine_translated": false,
      "summary": "Parliament voted the Foreigners Act amendments on the last day of 2025; in force 17 January 2026.",
      "location": {
        "page": 1,
        "page_end": null,
        "section": "Montenegro adopts amendments to the Foreigners Act",
        "paragraph": null,
        "snapshot_file": "sources/MNE/RES/originals/MNE-RES-2026-001_BDK-Foreigners-Act-Amendments-Note.html"
      },
      "quote_verified": true,
      "country": "MNE",
      "role": "comparator",
      "cluster": "2",
      "chapter": "02",
      "scope_basis": [
        "chapter"
      ],
      "themes": [],
      "dates": {
        "publication_date": "2026-01-22",
        "period_covered": null,
        "event_date": "2026-01-17",
        "event_date_precision": "day"
      },
      "speaker": {
        "name_as_stated": "BDK Advokati",
        "actor_id": "ACT-MNE-0001"
      },
      "subjects": [
        {
          "name_as_stated": "Parliament of Montenegro",
          "actor_id": "ACT-MNE-0010"
        }
      ],
      "intervention_as_stated": "amendments to the Foreigners Act",
      "stated_status": "adopted",
      "eu_scale": {
        "preparation_level": null,
        "progress_level": null,
        "applies_to": null
      },
      "metric": {
        "indicator": null,
        "value": null,
        "unit": null,
        "reference_period": null
      },
      "flags": [],
      "extraction_note": null,
      "pass2": {
        "chain_link": "comparator_evidence",
        "reform_issue_ids": [
          "RI-FMW-001"
        ],
        "mechanism_ids": [],
        "intervention_ids": [
          "INT-MNE-0002"
        ],
        "classification_status": "auto",
        "classification_note": "country_response: date of entry into force, secondary source."
      }
    },
    {
      "item_id": "MNE-RES-2026-001-0002",
      "information_type": "intervention",
      "stated_text": "Implementing regulations have to be enacted within further 12 months.",
      "quote_language": "en",
      "translation_en": null,
      "machine_translated": false,
      "summary": "Implementing regulations are due within a further 12 months.",
      "location": {
        "page": 1,
        "page_end": null,
        "section": "Montenegro adopts amendments to the Foreigners Act",
        "paragraph": null,
        "snapshot_file": "sources/MNE/RES/originals/MNE-RES-2026-001_BDK-Foreigners-Act-Amendments-Note.html"
      },
      "quote_verified": true,
      "country": "MNE",
      "role": "comparator",
      "cluster": "2",
      "chapter": "02",
      "scope_basis": [
        "chapter"
      ],
      "themes": [],
      "dates": {
        "publication_date": "2026-01-22",
        "period_covered": null,
        "event_date": null,
        "event_date_precision": null
      },
      "speaker": {
        "name_as_stated": "BDK Advokati",
        "actor_id": "ACT-MNE-0001"
      },
      "subjects": [
        {
          "name_as_stated": "Montenegro",
          "actor_id": "ACT-INT-0024"
        }
      ],
      "intervention_as_stated": "implementing regulations under the Foreigners Act amendments",
      "stated_status": "proposed",
      "eu_scale": {
        "preparation_level": null,
        "progress_level": null,
        "applies_to": null
      },
      "metric": {
        "indicator": null,
        "value": null,
        "unit": null,
        "reference_period": null
      },
      "flags": [],
      "extraction_note": null,
      "pass2": {
        "chain_link": "comparator_evidence",
        "reform_issue_ids": [
          "RI-FMW-001"
        ],
        "mechanism_ids": [],
        "intervention_ids": [
          "INT-MNE-0002"
        ],
        "classification_status": "auto",
        "classification_note": "country_response: implementing regulations due in 12 months."
      }
    },
    {
      "item_id": "MNE-RES-2026-001-0003",
      "information_type": "intervention",
      "stated_text": "(x) citizens of a EU or their family member (regardless of their nationality), as well as a citizen of Iceland, Liechtenstein, Norway, and Switzerland;",
      "quote_language": "en",
      "translation_en": null,
      "machine_translated": false,
      "summary": "Law firm lists EU citizens and family members among those exempt from the annual quota.",
      "location": {
        "page": 1,
        "page_end": null,
        "section": "Annual quota exemption",
        "paragraph": null,
        "snapshot_file": "sources/MNE/RES/originals/MNE-RES-2026-001_BDK-Foreigners-Act-Amendments-Note.html"
      },
      "quote_verified": true,
      "country": "MNE",
      "role": "comparator",
      "cluster": "2",
      "chapter": "02",
      "scope_basis": [
        "chapter"
      ],
      "themes": [],
      "dates": {
        "publication_date": "2026-01-22",
        "period_covered": null,
        "event_date": null,
        "event_date_precision": null
      },
      "speaker": {
        "name_as_stated": "BDK Advokati",
        "actor_id": "ACT-MNE-0001"
      },
      "subjects": [
        {
          "name_as_stated": "Montenegro",
          "actor_id": "ACT-INT-0024"
        }
      ],
      "intervention_as_stated": "annual quota exemption for EU citizens",
      "stated_status": "adopted",
      "eu_scale": {
        "preparation_level": null,
        "progress_level": null,
        "applies_to": null
      },
      "metric": {
        "indicator": null,
        "value": null,
        "unit": null,
        "reference_period": null
      },
      "flags": [],
      "extraction_note": "The note says nothing of timing. The primary text (MNE-GOV-2026-001, Art. 91, new Art. 221b) applies this exemption, Art. 78(1)(7v), only from the date of accession. Record as a conflict for pass 2; not resolved here.",
      "pass2": {
        "chain_link": "comparator_evidence",
        "reform_issue_ids": [
          "RI-FMW-001",
          "RI-FMW-002"
        ],
        "mechanism_ids": [],
        "intervention_ids": [
          "INT-MNE-0002"
        ],
        "classification_status": "auto",
        "classification_note": "country_response: quota exemption; same reasoning as MNE-GOV-2026-001-0002. The note omits that it applies only from accession (Art. 221b)."
      }
    },
    {
      "item_id": "MNE-RES-2026-001-0004",
      "information_type": "intervention",
      "stated_text": "This condition does not apply to the citizens of EU member states and their family members (regardless of nationality), as well as citizens of Iceland, Liechtenstein, Norway, and Switzerland.",
      "quote_language": "en",
      "translation_en": null,
      "machine_translated": false,
      "summary": "The tax condition for renewing integrated residence and work permits does not apply to EU citizens and family members.",
      "location": {
        "page": 1,
        "page_end": null,
        "section": "Renewal of integrated residence and work permit",
        "paragraph": null,
        "snapshot_file": "sources/MNE/RES/originals/MNE-RES-2026-001_BDK-Foreigners-Act-Amendments-Note.html"
      },
      "quote_verified": true,
      "country": "MNE",
      "role": "comparator",
      "cluster": "2",
      "chapter": "02",
      "scope_basis": [
        "chapter"
      ],
      "themes": [],
      "dates": {
        "publication_date": "2026-01-22",
        "period_covered": null,
        "event_date": null,
        "event_date_precision": null
      },
      "speaker": {
        "name_as_stated": "BDK Advokati",
        "actor_id": "ACT-MNE-0001"
      },
      "subjects": [
        {
          "name_as_stated": "Montenegro",
          "actor_id": "ACT-INT-0024"
        }
      ],
      "intervention_as_stated": "Law on amendments to the Law on Foreigners",
      "stated_status": "adopted",
      "eu_scale": {
        "preparation_level": null,
        "progress_level": null,
        "applies_to": null
      },
      "metric": {
        "indicator": null,
        "value": null,
        "unit": null,
        "reference_period": null
      },
      "flags": [],
      "extraction_note": "The condition is EUR 5,000 in taxes and contributions paid in the previous year, for entrepreneurs and owner-directors (previous sentence). The note says nothing of timing.",
      "pass2": {
        "chain_link": "comparator_evidence",
        "reform_issue_ids": [
          "RI-FMW-001",
          "RI-FMW-002"
        ],
        "mechanism_ids": [],
        "intervention_ids": [
          "INT-MNE-0002"
        ],
        "classification_status": "auto",
        "classification_note": "country_response: EU citizens exempt from a permit renewal condition; same reasoning. The note says nothing of timing."
      }
    }
  ]
}